{
  "schema": "nexus.service-build-recipe/v2",
  "recipe_id": "NEXUS_SMALLWORLD_EXACT_STDLIB_BUILD_RECIPE_V2",
  "source_repository": "Shtenco/agi_nexus",
  "source_commit": "2ee8f2a29ad2497afca6c7386375a296cd0bdbcf",
  "service_descriptor_source_path": "config/smallworld_compute_service_v2.json",
  "runtime_entrypoint": {
    "kind": "PYTHON_MODULE",
    "pythonpath": ".",
    "module": "agi_nexus.compute_service_v2"
  },
  "include_files": [
    {"source_path": "src/agi_nexus/__init__.py", "archive_path": "agi_nexus/__init__.py", "git_blob_sha": "31fc70d931290604bb77a4a44d374933ada6fad9"},
    {"source_path": "src/agi_nexus/compute_service_v2.py", "archive_path": "agi_nexus/compute_service_v2.py", "git_blob_sha": "25a14e6891344ae0dda3ddbb0a4f5578f7eee94d"},
    {"source_path": "src/agi_nexus/inventory.py", "archive_path": "agi_nexus/inventory.py", "git_blob_sha": "98209220b15374e37498b270b4fc0a8425e6a747"},
    {"source_path": "src/agi_nexus/smallworld_exact_v2.py", "archive_path": "agi_nexus/smallworld_exact_v2.py", "git_blob_sha": "dbeeccbe50437c0caa70f059ea3d05ed3ce89038"},
    {"source_path": "config/smallworld_compute_service_v2.json", "archive_path": "service_descriptor.json", "git_blob_sha": "4b6b8c5b89bf45834fd27f66599665da08b5fc50"}
  ],
  "archive_profile": {
    "format": "ZIP_STORED",
    "entry_order": "LEXICOGRAPHIC_ARCHIVE_PATH",
    "fixed_timestamp": "1980-01-01T00:00:00Z",
    "file_mode": "0644",
    "strip_extra_fields": true
  },
  "dependency_contract": "PYTHON_STDLIB_ONLY",
  "dependency_lock_status": "STDLIB_ONLY_NO_THIRD_PARTY_RUNTIME_DEPENDENCIES",
  "artifact_semantics": "EXECUTABLE_SOURCE_PACKAGE_CANDIDATE",
  "numeric_semantics": "EXACT_RATIONAL_METROPOLIS_V2",
  "build_authority": "SOURCE_REPOSITORY_ONLY",
  "execution_authority": "NONE",
  "recipe_digest": "3e255804dbd420492fc5481fe11d6333be2a50c8834bd4a8e3896de726f44089"
}
